{
  "base_lineage_ref": "master",
  "base_routing_source": "pr_base_ref",
  "boundary_record_version": "historical-information-boundary-v4",
  "case_id": "CASE_0CE9E03556F1",
  "historical_observability": "not_confirmed",
  "materialization": {
    "commit_sha": "29e4ded1cec15e96c82ffc44ab9a2095c449face",
    "complete_recursive_tree": true,
    "deterministic_repeat": true,
    "object_type": "commit",
    "parent_shas": [
      "dbf48f646f3f9a069b316495f476036b5c74c9d0"
    ],
    "recursive_tree_entry_count": 214,
    "recursive_tree_listing_sha256": "c997653681e0694d56ec62c7eafefa5c6065ed5d21ac8871c3e8e1a9214a9e38",
    "retrieved_at": "2026-10-05T20:15:38.183495+00:00",
    "source": "https://github.com/Altinity/clickhouse-backup.git",
    "status": "materialized",
    "tree_sha": "39b8ce83caea48fb900577228f5cd0d3df1ea90a"
  },
  "provenance_references": [
    "cases/reconstruction/CASE_0CE9E03556F1/historical_state_acquisition_v4.json",
    "cases/conversations/CASE_0CE9E03556F1/stage_c_extraction_v5.json"
  ],
  "reconstruction_contract": "post-stage-c-reconstruction-v4",
  "reconstruction_path": "base",
  "reconstruction_status": "reconstructed_base_state",
  "repository": "Altinity/clickhouse-backup",
  "selected_state": {
    "author_time": "2023-06-14T10:07:21Z",
    "author_time_sensitivity": "same_side_of_tfg",
    "commit_sha": "29e4ded1cec15e96c82ffc44ab9a2095c449face",
    "committer_time": "2023-06-14T10:07:21Z",
    "effective_time": "2023-06-14T10:07:21+00:00",
    "temporal_basis": "committer_time",
    "tree_sha": "39b8ce83caea48fb900577228f5cd0d3df1ea90a"
  },
  "tFG": {
    "source": "cases/manifests/stage_c_post_resolution_authority.csv",
    "value": "2023-06-15T12:00:33.229427+00:00"
  },
  "temporal_consistency": "consistent",
  "unresolved_reasons": []
}
