{
  "base_lineage_ref": "",
  "base_routing_source": "",
  "boundary_record_version": "historical-information-boundary-v4",
  "case_id": "CASE_194F3A461B65",
  "historical_observability": "not_confirmed",
  "materialization": {
    "commit_sha": "c86ee16f1886a4ca77ac049c81274f2d58f10099",
    "complete_recursive_tree": true,
    "deterministic_repeat": true,
    "object_type": "commit",
    "parent_shas": [
      "07bdf7985de02c65fcd80e00353e692ef8c46fca"
    ],
    "recursive_tree_entry_count": 400,
    "recursive_tree_listing_sha256": "53b3d86ac0190b916bac37bc87fcc8d9ecfc4e0387ab6b78852016eeae35c452",
    "retrieved_at": "2026-10-05T20:15:54.847841+00:00",
    "source": "https://github.com/VOICEVOX/voicevox.git",
    "status": "materialized",
    "tree_sha": "2a54f6e011a3457578f723c55b7ad6f99951352a"
  },
  "provenance_references": [
    "cases/reconstruction/CASE_194F3A461B65/historical_state_acquisition_v4.json",
    "cases/conversations/CASE_194F3A461B65/stage_c_extraction_v5.json"
  ],
  "reconstruction_contract": "post-stage-c-reconstruction-v4",
  "reconstruction_path": "focal",
  "reconstruction_status": "reconstructed_focal_state",
  "repository": "VOICEVOX/voicevox",
  "selected_state": {
    "author_time": "2024-02-18T05:43:07Z",
    "author_time_sensitivity": "same_side_of_tfg",
    "commit_sha": "c86ee16f1886a4ca77ac049c81274f2d58f10099",
    "committer_time": "2024-02-18T05:43:07Z",
    "effective_time": "2024-02-18T05:43:07+00:00",
    "temporal_basis": "committer_time",
    "tree_sha": "2a54f6e011a3457578f723c55b7ad6f99951352a"
  },
  "tFG": {
    "source": "cases/manifests/stage_c_post_resolution_authority.csv",
    "value": "2024-02-18T18:17:35.190572+00:00"
  },
  "temporal_consistency": "consistent",
  "unresolved_reasons": []
}
