{
  "base_lineage_ref": "master",
  "base_routing_source": "",
  "boundary_record_version": "historical-information-boundary-v4",
  "case_id": "CASE_D59F0752944D",
  "historical_observability": "not_confirmed",
  "materialization": {
    "commit_sha": "1ff6e8cfb144786d83d1f9b7c4195faa54852186",
    "complete_recursive_tree": true,
    "deterministic_repeat": true,
    "object_type": "commit",
    "parent_shas": [
      "7ca97ca0df925329f465cc470600446fbf00e1a8"
    ],
    "recursive_tree_entry_count": 661,
    "recursive_tree_listing_sha256": "19ce7f58a3c53cc4f824856abdb8c12a2e9d7498ba319953a44851af2bcd7b58",
    "retrieved_at": "2026-10-05T22:50:03.270358+00:00",
    "source": "https://github.com/robotology/icub-models-generator.git",
    "status": "materialized",
    "tree_sha": "dd9245a7acdbfe5be10acf560c0964fcb64c2127"
  },
  "provenance_references": [
    "cases/reconstruction/CASE_D59F0752944D/historical_state_acquisition_v4.json",
    "cases/conversations/CASE_D59F0752944D/stage_c_extraction_v5.json"
  ],
  "reconstruction_contract": "post-stage-c-reconstruction-v4",
  "reconstruction_path": "focal",
  "reconstruction_status": "reconstructed_focal_state",
  "repository": "robotology/icub-models-generator",
  "selected_state": {
    "author_time": "2024-01-09T13:19:42Z",
    "author_time_sensitivity": "same_side_of_tfg",
    "commit_sha": "1ff6e8cfb144786d83d1f9b7c4195faa54852186",
    "committer_time": "2024-01-09T13:19:42Z",
    "effective_time": "2024-01-09T13:19:42+00:00",
    "temporal_basis": "committer_time",
    "tree_sha": "dd9245a7acdbfe5be10acf560c0964fcb64c2127"
  },
  "tFG": {
    "source": "cases/manifests/stage_c_post_resolution_authority.csv",
    "value": "2024-01-10T13:48:51.124078+00:00"
  },
  "temporal_consistency": "consistent",
  "unresolved_reasons": []
}
