{
  "base_lineage_ref": "dev",
  "base_routing_source": "",
  "boundary_record_version": "historical-information-boundary-v4",
  "case_id": "CASE_F13F98792012",
  "historical_observability": "not_confirmed",
  "materialization": {
    "commit_sha": "efe8fa4f424f357399e7fdaebc5c666de987e597",
    "complete_recursive_tree": true,
    "deterministic_repeat": true,
    "object_type": "commit",
    "parent_shas": [
      "ebd30f10a856a398151b3b8009c0f833b64e4506"
    ],
    "recursive_tree_entry_count": 223,
    "recursive_tree_listing_sha256": "dd4a41e1e4ac5969727cb8d7def86d61e4caebffbabeae20c97aa6798474a765",
    "retrieved_at": "2026-10-05T19:19:43.618612+00:00",
    "source": "https://github.com/agentcoinorg/evo.ninja.git",
    "status": "materialized",
    "tree_sha": "b7faabb1dba156a77d30a98ec8724520a2b48768"
  },
  "provenance_references": [
    "cases/reconstruction/CASE_F13F98792012/historical_state_acquisition_v4.json",
    "cases/conversations/CASE_F13F98792012/stage_c_extraction_v5.json"
  ],
  "reconstruction_contract": "post-stage-c-reconstruction-v4",
  "reconstruction_path": "focal",
  "reconstruction_status": "reconstructed_focal_state",
  "repository": "agentcoinorg/evo.ninja",
  "selected_state": {
    "author_time": "2023-09-25T11:07:07Z",
    "author_time_sensitivity": "same_side_of_tfg",
    "commit_sha": "efe8fa4f424f357399e7fdaebc5c666de987e597",
    "committer_time": "2023-09-25T11:07:07Z",
    "effective_time": "2023-09-25T11:07:07+00:00",
    "temporal_basis": "committer_time",
    "tree_sha": "b7faabb1dba156a77d30a98ec8724520a2b48768"
  },
  "tFG": {
    "source": "cases/manifests/stage_c_post_resolution_authority.csv",
    "value": "2023-09-25T11:59:29.032600+00:00"
  },
  "temporal_consistency": "consistent",
  "unresolved_reasons": []
}
