{
  "base_lineage_ref": "main",
  "base_routing_source": "pr_base_ref",
  "boundary_record_version": "historical-information-boundary-v4",
  "case_id": "CASE_193801513E85",
  "historical_observability": "not_confirmed",
  "materialization": {
    "commit_sha": "968361dd412d7137042ec192dece98afaaba90da",
    "complete_recursive_tree": true,
    "deterministic_repeat": true,
    "object_type": "commit",
    "parent_shas": [
      "c7914d1838beb5a93e02fb1c244c8de0f6693c72"
    ],
    "recursive_tree_entry_count": 2439,
    "recursive_tree_listing_sha256": "57bf32a6c0c0cb449c3e9a77e7b5cab42f76e2f16f5b7c05182f8f2390c51aba",
    "retrieved_at": "2026-10-05T20:15:52.065337+00:00",
    "source": "https://github.com/SharezoneApp/sharezone-app.git",
    "status": "materialized",
    "tree_sha": "1880640c56eaff65327d47e9bd3ad62b0cb8ffdd"
  },
  "provenance_references": [
    "cases/reconstruction/CASE_193801513E85/historical_state_acquisition_v4.json",
    "cases/conversations/CASE_193801513E85/stage_c_extraction_v5.json"
  ],
  "reconstruction_contract": "post-stage-c-reconstruction-v4",
  "reconstruction_path": "base",
  "reconstruction_status": "reconstructed_base_state",
  "repository": "SharezoneApp/sharezone-app",
  "selected_state": {
    "author_time": "2023-09-15T19:28:02Z",
    "author_time_sensitivity": "same_side_of_tfg",
    "commit_sha": "968361dd412d7137042ec192dece98afaaba90da",
    "committer_time": "2023-09-15T19:28:02Z",
    "effective_time": "2023-09-15T19:28:02+00:00",
    "temporal_basis": "committer_time",
    "tree_sha": "1880640c56eaff65327d47e9bd3ad62b0cb8ffdd"
  },
  "tFG": {
    "source": "cases/manifests/stage_c_post_resolution_authority.csv",
    "value": "2023-09-16T11:14:32.846018+00:00"
  },
  "temporal_consistency": "consistent",
  "unresolved_reasons": []
}
