{
  "base_lineage_ref": "dev",
  "base_routing_source": "pr_base_ref",
  "boundary_record_version": "historical-information-boundary-v4",
  "case_id": "CASE_6C2918844CE5",
  "historical_observability": "not_confirmed",
  "materialization": {
    "commit_sha": "ca868eecf0e1bde8a3c7f3f399ab88deb629275b",
    "complete_recursive_tree": true,
    "deterministic_repeat": true,
    "object_type": "commit",
    "parent_shas": [
      "cef0393cb3ea552d820a714218e3a4c1c525eb55",
      "8d2fc6db23daaad769d48abbcaf7dee383f0f38a"
    ],
    "recursive_tree_entry_count": 193,
    "recursive_tree_listing_sha256": "7027aee01e6c7e0331a102182b55b67cbee80b037a2dd6368880dbce8500cf13",
    "retrieved_at": "2026-10-05T20:17:29.391390+00:00",
    "source": "https://github.com/uchicago-cs/chigame.git",
    "status": "materialized",
    "tree_sha": "20eaa05a378dae91290a1c50640c4ae9882b1528"
  },
  "provenance_references": [
    "cases/reconstruction/CASE_6C2918844CE5/historical_state_acquisition_v4.json",
    "cases/conversations/CASE_6C2918844CE5/stage_c_extraction_v5.json"
  ],
  "reconstruction_contract": "post-stage-c-reconstruction-v4",
  "reconstruction_path": "base",
  "reconstruction_status": "reconstructed_base_state",
  "repository": "uchicago-cs/chigame",
  "selected_state": {
    "author_time": "2023-11-14T20:27:57Z",
    "author_time_sensitivity": "same_side_of_tfg",
    "commit_sha": "ca868eecf0e1bde8a3c7f3f399ab88deb629275b",
    "committer_time": "2023-11-14T20:27:57Z",
    "effective_time": "2023-11-14T20:27:57+00:00",
    "temporal_basis": "committer_time",
    "tree_sha": "20eaa05a378dae91290a1c50640c4ae9882b1528"
  },
  "tFG": {
    "source": "cases/manifests/stage_c_post_resolution_authority.csv",
    "value": "2023-11-14T20:33:19.478217+00:00"
  },
  "temporal_consistency": "consistent",
  "unresolved_reasons": []
}
