{
  "base_lineage_ref": "main",
  "base_routing_source": "",
  "boundary_record_version": "historical-information-boundary-v4",
  "case_id": "CASE_E8F12807DBDC",
  "historical_observability": "not_confirmed",
  "materialization": {
    "commit_sha": "078d9f07d311a6693d77b97d41b9069fbd34c121",
    "complete_recursive_tree": true,
    "deterministic_repeat": true,
    "object_type": "commit",
    "parent_shas": [
      "b098856d2e4df4f9722b3412368ab2c3a30ee775"
    ],
    "recursive_tree_entry_count": 1594,
    "recursive_tree_listing_sha256": "749c96ff325b470c8c7ade0201ace9061de21d5f6d4d9c9fb9bbdb44a0e5b250",
    "retrieved_at": "2026-10-05T22:50:25.935747+00:00",
    "source": "https://github.com/annuaire-entreprises-data-gouv-fr/site.git",
    "status": "materialized",
    "tree_sha": "91b09a3ef67e86c61f175f6439a3f4f81fb0f8cc"
  },
  "provenance_references": [
    "cases/reconstruction/CASE_E8F12807DBDC/historical_state_acquisition_v4.json",
    "cases/conversations/CASE_E8F12807DBDC/stage_c_extraction_v5.json"
  ],
  "reconstruction_contract": "post-stage-c-reconstruction-v4",
  "reconstruction_path": "focal",
  "reconstruction_status": "reconstructed_focal_state",
  "repository": "annuaire-entreprises-data-gouv-fr/site",
  "selected_state": {
    "author_time": "2023-11-29T14:43:50Z",
    "author_time_sensitivity": "same_side_of_tfg",
    "commit_sha": "078d9f07d311a6693d77b97d41b9069fbd34c121",
    "committer_time": "2023-11-29T14:43:50Z",
    "effective_time": "2023-11-29T14:43:50+00:00",
    "temporal_basis": "committer_time",
    "tree_sha": "91b09a3ef67e86c61f175f6439a3f4f81fb0f8cc"
  },
  "tFG": {
    "source": "cases/manifests/stage_c_post_resolution_authority.csv",
    "value": "2023-11-29T15:30:05.280608+00:00"
  },
  "temporal_consistency": "consistent",
  "unresolved_reasons": []
}
