{
  "base_lineage_ref": "",
  "base_routing_source": "",
  "boundary_record_version": "historical-information-boundary-v4",
  "case_id": "CASE_298A455FBBD8",
  "historical_observability": "not_confirmed",
  "materialization": {
    "commit_sha": "2b6ba9e03d8cfcd40f1c26cfe6ad571f3b35a837",
    "complete_recursive_tree": true,
    "deterministic_repeat": true,
    "object_type": "commit",
    "parent_shas": [
      "0334e03ea73e24d6b7e3cec7419aad4962f64d34"
    ],
    "recursive_tree_entry_count": 41,
    "recursive_tree_listing_sha256": "33fca4efd11307b4cc5c198376e223a9aff5f0fbc27d8f2950c3037de59a752b",
    "retrieved_at": "2026-10-05T20:16:13.801331+00:00",
    "source": "https://github.com/whatwg/html-build.git",
    "status": "materialized",
    "tree_sha": "d9532cb8159bc301d3f26dc7c9e6a4f01a70a875"
  },
  "provenance_references": [
    "cases/reconstruction/CASE_298A455FBBD8/historical_state_acquisition_v4.json",
    "cases/conversations/CASE_298A455FBBD8/stage_c_extraction_v5.json"
  ],
  "reconstruction_contract": "post-stage-c-reconstruction-v4",
  "reconstruction_path": "focal",
  "reconstruction_status": "reconstructed_focal_state",
  "repository": "whatwg/html-build",
  "selected_state": {
    "author_time": "2024-02-09T05:23:18Z",
    "author_time_sensitivity": "same_side_of_tfg",
    "commit_sha": "2b6ba9e03d8cfcd40f1c26cfe6ad571f3b35a837",
    "committer_time": "2024-02-09T05:23:18Z",
    "effective_time": "2024-02-09T05:23:18+00:00",
    "temporal_basis": "committer_time",
    "tree_sha": "d9532cb8159bc301d3f26dc7c9e6a4f01a70a875"
  },
  "tFG": {
    "source": "cases/manifests/stage_c_post_resolution_authority.csv",
    "value": "2024-02-09T05:53:05.925557+00:00"
  },
  "temporal_consistency": "consistent",
  "unresolved_reasons": []
}
