{
  "base_lineage_ref": "main",
  "base_routing_source": "pr_base_ref",
  "boundary_record_version": "historical-information-boundary-v4",
  "case_id": "CASE_36ED555D6DE4",
  "historical_observability": "not_confirmed",
  "materialization": {
    "commit_sha": "5ec1b047729d2733e857f37b8348a19f776159a4",
    "complete_recursive_tree": true,
    "deterministic_repeat": true,
    "object_type": "commit",
    "parent_shas": [
      "fb566a26b9266323537c900ab235b7315bcf3379"
    ],
    "recursive_tree_entry_count": 91,
    "recursive_tree_listing_sha256": "6518cfe4d579d1869de6cac11eede026aa7b53d667fd32c3a7186d8d58f63bdd",
    "retrieved_at": "2026-10-05T20:16:40.087095+00:00",
    "source": "https://github.com/poki/netlib.git",
    "status": "materialized",
    "tree_sha": "c082700086abdac34f43157eaf75d94d14215875"
  },
  "provenance_references": [
    "cases/reconstruction/CASE_36ED555D6DE4/historical_state_acquisition_v4.json",
    "cases/conversations/CASE_36ED555D6DE4/stage_c_extraction_v5.json"
  ],
  "reconstruction_contract": "post-stage-c-reconstruction-v4",
  "reconstruction_path": "base",
  "reconstruction_status": "reconstructed_base_state",
  "repository": "poki/netlib",
  "selected_state": {
    "author_time": "2023-08-21T13:13:03Z",
    "author_time_sensitivity": "same_side_of_tfg",
    "commit_sha": "5ec1b047729d2733e857f37b8348a19f776159a4",
    "committer_time": "2023-08-21T13:13:03Z",
    "effective_time": "2023-08-21T13:13:03+00:00",
    "temporal_basis": "committer_time",
    "tree_sha": "c082700086abdac34f43157eaf75d94d14215875"
  },
  "tFG": {
    "source": "cases/manifests/stage_c_post_resolution_authority.csv",
    "value": "2023-08-21T13:20:58.574449+00:00"
  },
  "temporal_consistency": "consistent",
  "unresolved_reasons": []
}
