{
  "base_lineage_ref": "main",
  "base_routing_source": "",
  "boundary_record_version": "historical-information-boundary-v4",
  "case_id": "CASE_F04D9F77AEBD",
  "historical_observability": "not_confirmed",
  "materialization": {
    "commit_sha": "02fd161ef0269b531698ac835b2c3a0b9adf719c",
    "complete_recursive_tree": true,
    "deterministic_repeat": true,
    "object_type": "commit",
    "parent_shas": [
      "de9d5af07e9beec074aa36abce78070e9a94fe74"
    ],
    "recursive_tree_entry_count": 2971,
    "recursive_tree_listing_sha256": "9a0c5007989c865a04351168e7a48cdac652fdff966a012f5daec5d49e88cbf4",
    "retrieved_at": "2026-10-05T22:50:46.940592+00:00",
    "source": "https://github.com/firezone/firezone.git",
    "status": "materialized",
    "tree_sha": "0e754564462f43ab05cba92d2552ec6519bafe8d"
  },
  "provenance_references": [
    "cases/reconstruction/CASE_F04D9F77AEBD/historical_state_acquisition_v4.json",
    "cases/conversations/CASE_F04D9F77AEBD/stage_c_extraction_v5.json"
  ],
  "reconstruction_contract": "post-stage-c-reconstruction-v4",
  "reconstruction_path": "focal",
  "reconstruction_status": "reconstructed_focal_state",
  "repository": "firezone/firezone",
  "selected_state": {
    "author_time": "2024-02-14T16:52:08Z",
    "author_time_sensitivity": "same_side_of_tfg",
    "commit_sha": "02fd161ef0269b531698ac835b2c3a0b9adf719c",
    "committer_time": "2024-02-14T16:52:08Z",
    "effective_time": "2024-02-14T16:52:08+00:00",
    "temporal_basis": "committer_time",
    "tree_sha": "0e754564462f43ab05cba92d2552ec6519bafe8d"
  },
  "tFG": {
    "source": "cases/manifests/stage_c_post_resolution_authority.csv",
    "value": "2024-02-14T16:56:24.662180+00:00"
  },
  "temporal_consistency": "consistent",
  "unresolved_reasons": []
}
