{
  "base_lineage_ref": "main",
  "base_routing_source": "pr_base_ref",
  "boundary_record_version": "historical-information-boundary-v4",
  "case_id": "CASE_A1DC1299D73A",
  "historical_observability": "not_confirmed",
  "materialization": {
    "commit_sha": "9545baf1f71923b4a5094dac707224c5d99497c4",
    "complete_recursive_tree": true,
    "deterministic_repeat": true,
    "object_type": "commit",
    "parent_shas": [
      "12ac7b0e52832fefc6c5d0b29ac1236094fcf19a"
    ],
    "recursive_tree_entry_count": 203,
    "recursive_tree_listing_sha256": "86006960669a3e6aa775743bc0f31c9717eaf18a4fb84591792b6856290d9267",
    "retrieved_at": "2026-10-05T20:18:44.621437+00:00",
    "source": "https://github.com/UNLV-CS472-672/2024-S-GROUP1-Roadwatch.git",
    "status": "materialized",
    "tree_sha": "3a82aaaba0f82026b111e48a9aeadad9ac1f9aae"
  },
  "provenance_references": [
    "cases/reconstruction/CASE_A1DC1299D73A/historical_state_acquisition_v4.json",
    "cases/conversations/CASE_A1DC1299D73A/stage_c_extraction_v5.json"
  ],
  "reconstruction_contract": "post-stage-c-reconstruction-v4",
  "reconstruction_path": "base",
  "reconstruction_status": "reconstructed_base_state",
  "repository": "UNLV-CS472-672/2024-S-GROUP1-Roadwatch",
  "selected_state": {
    "author_time": "2024-04-11T00:26:18Z",
    "author_time_sensitivity": "same_side_of_tfg",
    "commit_sha": "9545baf1f71923b4a5094dac707224c5d99497c4",
    "committer_time": "2024-04-11T00:26:18Z",
    "effective_time": "2024-04-11T00:26:18+00:00",
    "temporal_basis": "committer_time",
    "tree_sha": "3a82aaaba0f82026b111e48a9aeadad9ac1f9aae"
  },
  "tFG": {
    "source": "cases/manifests/stage_c_post_resolution_authority.csv",
    "value": "2024-04-11T21:03:17.338142+00:00"
  },
  "temporal_consistency": "consistent",
  "unresolved_reasons": []
}
