{
  "base_lineage_ref": "main",
  "base_routing_source": "",
  "boundary_record_version": "historical-information-boundary-v4",
  "case_id": "CASE_E22541DBFCC2",
  "historical_observability": "not_confirmed",
  "materialization": {
    "commit_sha": "ab033a0ca8a7eb208535dfebdb1d74cb01e831a6",
    "complete_recursive_tree": true,
    "deterministic_repeat": true,
    "object_type": "commit",
    "parent_shas": [
      "353ca05770dfb9e9c91e1c998dc1fce3fa891726",
      "0544743cc762c68c56116e9803c1f06d0039d632"
    ],
    "recursive_tree_entry_count": 459,
    "recursive_tree_listing_sha256": "7c6f3dd0675d54aac2a54d46b341a1fdfb42c954efed978c5ebe18a29e0850a6",
    "retrieved_at": "2026-10-05T22:50:20.767119+00:00",
    "source": "https://github.com/UNLV-CS472-672/2024-S-GROUP3-Barbell.git",
    "status": "materialized",
    "tree_sha": "1d53002cdf1d6bb293736913267d8cb2dab65d19"
  },
  "provenance_references": [
    "cases/reconstruction/CASE_E22541DBFCC2/historical_state_acquisition_v4.json",
    "cases/conversations/CASE_E22541DBFCC2/stage_c_extraction_v5.json"
  ],
  "reconstruction_contract": "post-stage-c-reconstruction-v4",
  "reconstruction_path": "focal",
  "reconstruction_status": "reconstructed_focal_state",
  "repository": "UNLV-CS472-672/2024-S-GROUP3-Barbell",
  "selected_state": {
    "author_time": "2024-04-24T04:41:40Z",
    "author_time_sensitivity": "same_side_of_tfg",
    "commit_sha": "ab033a0ca8a7eb208535dfebdb1d74cb01e831a6",
    "committer_time": "2024-04-24T04:41:40Z",
    "effective_time": "2024-04-24T04:41:40+00:00",
    "temporal_basis": "committer_time",
    "tree_sha": "1d53002cdf1d6bb293736913267d8cb2dab65d19"
  },
  "tFG": {
    "source": "cases/manifests/stage_c_post_resolution_authority.csv",
    "value": "2024-04-24T09:34:57.715598+00:00"
  },
  "temporal_consistency": "consistent",
  "unresolved_reasons": []
}
