{
  "base_lineage_ref": "master",
  "base_routing_source": "pr_base_ref",
  "boundary_record_version": "historical-information-boundary-v4",
  "case_id": "CASE_85AD863F8290",
  "historical_observability": "not_confirmed",
  "materialization": {
    "commit_sha": "e3997d0f6cff865270b3abf645c289f2c3f519c5",
    "complete_recursive_tree": true,
    "deterministic_repeat": true,
    "object_type": "commit",
    "parent_shas": [
      "feb9c9e677bea5a657a2237854b26be87f433ec0"
    ],
    "recursive_tree_entry_count": 276,
    "recursive_tree_listing_sha256": "2dcf23e7b41ed7a121e7a36afc2c344236c99f3be30270bc5682c1b4cc62e00a",
    "retrieved_at": "2026-10-05T19:19:35.804951+00:00",
    "source": "https://github.com/alshedivat/al-folio.git",
    "status": "materialized",
    "tree_sha": "6b95eb2c0a265b5aeaaa995b96237ba160fcc652"
  },
  "provenance_references": [
    "cases/reconstruction/CASE_85AD863F8290/historical_state_acquisition_v4.json",
    "cases/conversations/CASE_85AD863F8290/stage_c_extraction_v5.json"
  ],
  "reconstruction_contract": "post-stage-c-reconstruction-v4",
  "reconstruction_path": "base",
  "reconstruction_status": "reconstructed_base_state",
  "repository": "alshedivat/al-folio",
  "selected_state": {
    "author_time": "2024-01-08T17:35:42Z",
    "author_time_sensitivity": "same_side_of_tfg",
    "commit_sha": "e3997d0f6cff865270b3abf645c289f2c3f519c5",
    "committer_time": "2024-01-08T17:35:42Z",
    "effective_time": "2024-01-08T17:35:42+00:00",
    "temporal_basis": "committer_time",
    "tree_sha": "6b95eb2c0a265b5aeaaa995b96237ba160fcc652"
  },
  "tFG": {
    "source": "cases/manifests/stage_c_post_resolution_authority.csv",
    "value": "2024-01-09T07:36:25.716598+00:00"
  },
  "temporal_consistency": "consistent",
  "unresolved_reasons": []
}
