{
  "base_lineage_ref": "",
  "base_routing_source": "",
  "boundary_record_version": "historical-information-boundary-v4",
  "case_id": "CASE_2D5D7C7DC776",
  "historical_observability": "not_confirmed",
  "materialization": {
    "commit_sha": "57e3208224b6675f4632b056c4ee4c54b55fa842",
    "complete_recursive_tree": true,
    "deterministic_repeat": true,
    "object_type": "commit",
    "parent_shas": [
      "02afa50e2cb709b5242b8e9e3be955657d7bd5b0"
    ],
    "recursive_tree_entry_count": 413,
    "recursive_tree_listing_sha256": "76483274878751d6b2aee2063cea65af1761deba0062527de7129e24931cc911",
    "retrieved_at": "2026-10-05T20:16:23.658875+00:00",
    "source": "https://github.com/UNLV-CS472-672/2024-S-GROUP3-Barbell.git",
    "status": "materialized",
    "tree_sha": "93d4fa659c621402c80abf95772bb66099c7ddac"
  },
  "provenance_references": [
    "cases/reconstruction/CASE_2D5D7C7DC776/historical_state_acquisition_v4.json",
    "cases/conversations/CASE_2D5D7C7DC776/stage_c_extraction_v5.json"
  ],
  "reconstruction_contract": "post-stage-c-reconstruction-v4",
  "reconstruction_path": "focal",
  "reconstruction_status": "reconstructed_focal_state",
  "repository": "UNLV-CS472-672/2024-S-GROUP3-Barbell",
  "selected_state": {
    "author_time": "2024-04-20T22:02:41Z",
    "author_time_sensitivity": "same_side_of_tfg",
    "commit_sha": "57e3208224b6675f4632b056c4ee4c54b55fa842",
    "committer_time": "2024-04-20T22:02:41Z",
    "effective_time": "2024-04-20T22:02:41+00:00",
    "temporal_basis": "committer_time",
    "tree_sha": "93d4fa659c621402c80abf95772bb66099c7ddac"
  },
  "tFG": {
    "source": "cases/manifests/stage_c_post_resolution_authority.csv",
    "value": "2024-04-21T03:56:24.373903+00:00"
  },
  "temporal_consistency": "consistent",
  "unresolved_reasons": []
}
