{
  "base_lineage_ref": "master",
  "base_routing_source": "pr_base_ref",
  "boundary_record_version": "historical-information-boundary-v4",
  "case_id": "CASE_B0892F2A5485",
  "historical_observability": "not_confirmed",
  "materialization": {
    "commit_sha": "5911de117b58f3c3ffb2bee73a7e38c37b3836db",
    "complete_recursive_tree": true,
    "deterministic_repeat": true,
    "object_type": "commit",
    "parent_shas": [
      "f8d5fc7fe1056cb42baeaa94da08d9e691dd2cde"
    ],
    "recursive_tree_entry_count": 64,
    "recursive_tree_listing_sha256": "b362e6e36256d8273c326d5afbe3c78d7a89d3f4665b3b689254a855673396ca",
    "retrieved_at": "2026-10-05T20:19:10.204375+00:00",
    "source": "https://github.com/VyProductions/SeniorDesign.git",
    "status": "materialized",
    "tree_sha": "9073d92755ba09142484a98ba8e1e4f688803432"
  },
  "provenance_references": [
    "cases/reconstruction/CASE_B0892F2A5485/historical_state_acquisition_v4.json",
    "cases/conversations/CASE_B0892F2A5485/stage_c_extraction_v5.json"
  ],
  "reconstruction_contract": "post-stage-c-reconstruction-v4",
  "reconstruction_path": "base",
  "reconstruction_status": "reconstructed_base_state",
  "repository": "VyProductions/SeniorDesign",
  "selected_state": {
    "author_time": "2024-02-14T08:51:32Z",
    "author_time_sensitivity": "same_side_of_tfg",
    "commit_sha": "5911de117b58f3c3ffb2bee73a7e38c37b3836db",
    "committer_time": "2024-02-14T08:51:32Z",
    "effective_time": "2024-02-14T08:51:32+00:00",
    "temporal_basis": "committer_time",
    "tree_sha": "9073d92755ba09142484a98ba8e1e4f688803432"
  },
  "tFG": {
    "source": "cases/manifests/stage_c_post_resolution_authority.csv",
    "value": "2024-02-14T20:21:41.599236+00:00"
  },
  "temporal_consistency": "consistent",
  "unresolved_reasons": []
}
