{
  "base_lineage_ref": "master",
  "base_routing_source": "",
  "boundary_record_version": "historical-information-boundary-v4",
  "case_id": "CASE_E6ADDBF1751F",
  "historical_observability": "not_confirmed",
  "materialization": {
    "commit_sha": "febbda8d787b4bc0b88aa88ddb640a5f5c401ecc",
    "complete_recursive_tree": true,
    "deterministic_repeat": true,
    "object_type": "commit",
    "parent_shas": [
      "fe7629b996250b0661e78fb5f79e83648d1bc3c3"
    ],
    "recursive_tree_entry_count": 704,
    "recursive_tree_listing_sha256": "186210a5235d9516fb01fdbd2a739169742962596633c32dca173589fb13ea3a",
    "retrieved_at": "2026-10-05T22:50:23.211322+00:00",
    "source": "https://github.com/netket/netket.git",
    "status": "materialized",
    "tree_sha": "9ac4cce6c72f7114a746b3f4dda26a7b0a03141f"
  },
  "provenance_references": [
    "cases/reconstruction/CASE_E6ADDBF1751F/historical_state_acquisition_v4.json",
    "cases/conversations/CASE_E6ADDBF1751F/stage_c_extraction_v5.json"
  ],
  "reconstruction_contract": "post-stage-c-reconstruction-v4",
  "reconstruction_path": "focal",
  "reconstruction_status": "reconstructed_focal_state",
  "repository": "netket/netket",
  "selected_state": {
    "author_time": "2023-11-02T12:53:35Z",
    "author_time_sensitivity": "same_side_of_tfg",
    "commit_sha": "febbda8d787b4bc0b88aa88ddb640a5f5c401ecc",
    "committer_time": "2023-11-02T12:58:10Z",
    "effective_time": "2023-11-02T12:58:10+00:00",
    "temporal_basis": "committer_time",
    "tree_sha": "9ac4cce6c72f7114a746b3f4dda26a7b0a03141f"
  },
  "tFG": {
    "source": "cases/manifests/stage_c_post_resolution_authority.csv",
    "value": "2023-11-02T13:01:48.037682+00:00"
  },
  "temporal_consistency": "consistent",
  "unresolved_reasons": []
}
