{
  "base_lineage_ref": "main",
  "base_routing_source": "pr_base_ref",
  "boundary_record_version": "historical-information-boundary-v4",
  "case_id": "CASE_8A756AAC10B8",
  "historical_observability": "not_confirmed",
  "materialization": {
    "commit_sha": "cae2816141b3a7d3fbfb0d46728e5c9c6b9d0ca0",
    "complete_recursive_tree": true,
    "deterministic_repeat": true,
    "object_type": "commit",
    "parent_shas": [
      "63ac5f389e3df8187d62db1e54f2b77cb7d966df",
      "ddfd65dd922d7b176ec5260055477cc937e6c470"
    ],
    "recursive_tree_entry_count": 492,
    "recursive_tree_listing_sha256": "bc62045127829bf8bc55b6fea953152e73374fe1a5feff9978ba517a26d0b584",
    "retrieved_at": "2026-10-05T20:18:13.085551+00:00",
    "source": "https://github.com/itpplasma/libneo.git",
    "status": "materialized",
    "tree_sha": "e5e98191533f29f0106308d374b41debbe7df63a"
  },
  "provenance_references": [
    "cases/reconstruction/CASE_8A756AAC10B8/historical_state_acquisition_v4.json",
    "cases/conversations/CASE_8A756AAC10B8/stage_c_extraction_v5.json"
  ],
  "reconstruction_contract": "post-stage-c-reconstruction-v4",
  "reconstruction_path": "base",
  "reconstruction_status": "reconstructed_base_state",
  "repository": "itpplasma/libneo",
  "selected_state": {
    "author_time": "2024-01-24T12:23:48Z",
    "author_time_sensitivity": "same_side_of_tfg",
    "commit_sha": "cae2816141b3a7d3fbfb0d46728e5c9c6b9d0ca0",
    "committer_time": "2024-01-24T12:23:48Z",
    "effective_time": "2024-01-24T12:23:48+00:00",
    "temporal_basis": "committer_time",
    "tree_sha": "e5e98191533f29f0106308d374b41debbe7df63a"
  },
  "tFG": {
    "source": "cases/manifests/stage_c_post_resolution_authority.csv",
    "value": "2024-01-24T12:29:52.633607+00:00"
  },
  "temporal_consistency": "consistent",
  "unresolved_reasons": []
}
