{
  "base_lineage_ref": "main",
  "base_routing_source": "",
  "boundary_record_version": "historical-information-boundary-v4",
  "case_id": "CASE_BFB2599E145D",
  "historical_observability": "not_confirmed",
  "materialization": {
    "commit_sha": "c241900c8d6ac0ac6a7f7529c0e0dd87198dd348",
    "complete_recursive_tree": true,
    "deterministic_repeat": true,
    "object_type": "commit",
    "parent_shas": [
      "b3894922b09186f033f5db9ff9a5d6ec9f20c531"
    ],
    "recursive_tree_entry_count": 262,
    "recursive_tree_listing_sha256": "c7b7d837272fc170477390f67897c29f52142a55b5716d6d8789ef14d0bc4eb3",
    "retrieved_at": "2026-10-05T19:19:38.267209+00:00",
    "source": "https://github.com/hufscheer/web-v1.git",
    "status": "materialized",
    "tree_sha": "f111151e1f9972045746a99915c2ef407f52252f"
  },
  "provenance_references": [
    "cases/reconstruction/CASE_BFB2599E145D/historical_state_acquisition_v4.json",
    "cases/conversations/CASE_BFB2599E145D/stage_c_extraction_v5.json"
  ],
  "reconstruction_contract": "post-stage-c-reconstruction-v4",
  "reconstruction_path": "focal",
  "reconstruction_status": "reconstructed_focal_state",
  "repository": "hufscheer/web-v1",
  "selected_state": {
    "author_time": "2023-11-30T08:17:17Z",
    "author_time_sensitivity": "same_side_of_tfg",
    "commit_sha": "c241900c8d6ac0ac6a7f7529c0e0dd87198dd348",
    "committer_time": "2023-11-30T08:17:17Z",
    "effective_time": "2023-11-30T08:17:17+00:00",
    "temporal_basis": "committer_time",
    "tree_sha": "f111151e1f9972045746a99915c2ef407f52252f"
  },
  "tFG": {
    "source": "cases/manifests/stage_c_post_resolution_authority.csv",
    "value": "2023-11-30T08:40:22.179209+00:00"
  },
  "temporal_consistency": "consistent",
  "unresolved_reasons": []
}
