{
  "base_lineage_ref": "main",
  "base_routing_source": "pr_base_ref",
  "boundary_record_version": "historical-information-boundary-v4",
  "case_id": "CASE_CE6B20EEAAB5",
  "historical_observability": "not_confirmed",
  "materialization": {
    "commit_sha": "7c13dd8d9d1a01a5715339cf3a8d37a23990f8f7",
    "complete_recursive_tree": true,
    "deterministic_repeat": true,
    "object_type": "commit",
    "parent_shas": [
      "fa15c2b057548ce9d276dc91d1cbf5ef6f8dd505"
    ],
    "recursive_tree_entry_count": 408,
    "recursive_tree_listing_sha256": "69d3a1efc66b5d4d63c9f116566a04d78b6076ed42e166cdd6b104e25df721f1",
    "retrieved_at": "2026-10-05T22:49:54.863048+00:00",
    "source": "https://github.com/UNLV-CS472-672/2024-S-GROUP3-Barbell.git",
    "status": "materialized",
    "tree_sha": "73a2285657e0ef25a5217b29176adbdf6c19e9c5"
  },
  "provenance_references": [
    "cases/reconstruction/CASE_CE6B20EEAAB5/historical_state_acquisition_v4.json",
    "cases/conversations/CASE_CE6B20EEAAB5/stage_c_extraction_v6.json"
  ],
  "reconstruction_contract": "post-stage-c-reconstruction-v4",
  "reconstruction_path": "base",
  "reconstruction_status": "reconstructed_base_state",
  "repository": "UNLV-CS472-672/2024-S-GROUP3-Barbell",
  "selected_state": {
    "author_time": "2024-04-19T08:07:58Z",
    "author_time_sensitivity": "same_side_of_tfg",
    "commit_sha": "7c13dd8d9d1a01a5715339cf3a8d37a23990f8f7",
    "committer_time": "2024-04-19T08:07:58Z",
    "effective_time": "2024-04-19T08:07:58+00:00",
    "temporal_basis": "committer_time",
    "tree_sha": "73a2285657e0ef25a5217b29176adbdf6c19e9c5"
  },
  "tFG": {
    "source": "cases/manifests/stage_c_post_resolution_authority.csv",
    "value": "2024-04-20T03:55:44.695452+00:00"
  },
  "temporal_consistency": "consistent",
  "unresolved_reasons": []
}
