{
  "base_lineage_ref": "development",
  "base_routing_source": "pr_base_ref",
  "boundary_record_version": "historical-information-boundary-v4",
  "case_id": "CASE_EFB57C0D7D17",
  "historical_observability": "not_confirmed",
  "materialization": {
    "commit_sha": "2f58f4378e1e8eb297f5bb4a2464240a8210fc9d",
    "complete_recursive_tree": true,
    "deterministic_repeat": true,
    "object_type": "commit",
    "parent_shas": [
      "e4d2227ecb09f1854735ce892519df107e7be6c9"
    ],
    "recursive_tree_entry_count": 1028,
    "recursive_tree_listing_sha256": "d10ad9ca1353f321e6fe8ccb98dae66003d9843b32084c31754b150bdb1328b6",
    "retrieved_at": "2026-10-05T22:50:43.436101+00:00",
    "source": "https://github.com/Mudlet/Mudlet.git",
    "status": "materialized",
    "tree_sha": "d7516a144552eacfd40a8e1e7f0d4158e2c42bf1"
  },
  "provenance_references": [
    "cases/reconstruction/CASE_EFB57C0D7D17/historical_state_acquisition_v4.json",
    "cases/conversations/CASE_EFB57C0D7D17/stage_c_extraction_v5.json"
  ],
  "reconstruction_contract": "post-stage-c-reconstruction-v4",
  "reconstruction_path": "base",
  "reconstruction_status": "reconstructed_base_state",
  "repository": "Mudlet/Mudlet",
  "selected_state": {
    "author_time": "2024-02-06T09:50:35Z",
    "author_time_sensitivity": "same_side_of_tfg",
    "commit_sha": "2f58f4378e1e8eb297f5bb4a2464240a8210fc9d",
    "committer_time": "2024-02-06T09:50:35Z",
    "effective_time": "2024-02-06T09:50:35+00:00",
    "temporal_basis": "committer_time",
    "tree_sha": "d7516a144552eacfd40a8e1e7f0d4158e2c42bf1"
  },
  "tFG": {
    "source": "cases/manifests/stage_c_post_resolution_authority.csv",
    "value": "2024-02-07T19:21:54.930568+00:00"
  },
  "temporal_consistency": "consistent",
  "unresolved_reasons": []
}
