{
  "base_lineage_ref": "",
  "base_routing_source": "",
  "boundary_record_version": "historical-information-boundary-v4",
  "case_id": "CASE_BD187BC12672",
  "historical_observability": "not_confirmed",
  "materialization": {
    "commit_sha": "1c9b9929add4a3eeaf42f4e1fd09f569a299356c",
    "complete_recursive_tree": true,
    "deterministic_repeat": true,
    "object_type": "commit",
    "parent_shas": [
      "5b5fadb2cb1d21c43abacffe2f58ab4ec76ca543"
    ],
    "recursive_tree_entry_count": 25460,
    "recursive_tree_listing_sha256": "e64b4624c68881ee283281d65b80d1a4ef1d80a4d6a686b2c474c2d0e20e4240",
    "retrieved_at": "2026-10-05T20:19:30.065112+00:00",
    "source": "https://github.com/mdn/content.git",
    "status": "materialized",
    "tree_sha": "4ebda115aea94f28e0e8390db45ddaf0dde43a3a"
  },
  "provenance_references": [
    "cases/reconstruction/CASE_BD187BC12672/historical_state_acquisition_v4.json",
    "cases/conversations/CASE_BD187BC12672/stage_c_extraction_v5.json"
  ],
  "reconstruction_contract": "post-stage-c-reconstruction-v4",
  "reconstruction_path": "focal",
  "reconstruction_status": "reconstructed_focal_state",
  "repository": "mdn/content",
  "selected_state": {
    "author_time": "2023-05-31T14:22:29Z",
    "author_time_sensitivity": "same_side_of_tfg",
    "commit_sha": "1c9b9929add4a3eeaf42f4e1fd09f569a299356c",
    "committer_time": "2023-05-31T14:22:29Z",
    "effective_time": "2023-05-31T14:22:29+00:00",
    "temporal_basis": "committer_time",
    "tree_sha": "4ebda115aea94f28e0e8390db45ddaf0dde43a3a"
  },
  "tFG": {
    "source": "cases/manifests/stage_c_post_resolution_authority.csv",
    "value": "2023-05-31T19:28:34.435239+00:00"
  },
  "temporal_consistency": "consistent",
  "unresolved_reasons": []
}
